{
  "receipt_id": "gr_loot_001",
  "event_type": "loot_drop",
  "core_receipt_ref": "receipt_sha256:core_loot_001",
  "game_event": {
    "game_id": "arena-alpha",
    "session_id": "sess-1001",
    "event_ts_utc": "2026-03-29T18:00:00Z",
    "actor_id": "player-77",
    "policy_version": "loot-v3",
    "payload": {
      "drop_table_id": "legendary_weekend",
      "item_awarded": "dragon_blade"
    }
  },
  "receipt_extension": {
    "extension_version": "x1",
    "mode": "entropy_proof",
    "entropy": {
      "entropy_score": 0.81,
      "entropy_source": "runtime_entropy_v1",
      "freshness_window_sec": 120,
      "sample_ts_utc": "2026-03-29T18:00:00Z"
    },
    "vrf": {
      "proof": "vrf_proof_loot_001",
      "public_key": "vrf_pk_game_ops",
      "domain": "loot-drop"
    },
    "policy_path": {
      "selected_path": "entropy_proof",
      "fallback_path": "baseline",
      "reason": "fairness-critical",
      "required": false
    }
  },
  "chain": {
    "prev_hash": "hash_prev_loot_000",
    "seq": 101
  },
  "anchoring": {
    "strategy": "periodic_root",
    "anchor_ref": "pending"
  }
}
